{
  "schemaVersion": "2.0.0",
  "labId": "14",
  "runId": "fixture-demo",
  "status": "passed",
  "checkpoints": [
    {
      "id": "CP1",
      "status": "passed"
    },
    {
      "id": "CP2",
      "status": "passed"
    },
    {
      "id": "CP3",
      "status": "passed"
    },
    {
      "id": "CP4",
      "status": "passed"
    },
    {
      "id": "CP5",
      "status": "passed"
    }
  ],
  "breakFix": "passed",
  "integration": "not-required",
  "verifiedAt": "2026-10-16T00:00:00Z"
}
